{"dataset":"bips","api_version":"v1","schema_version":"1.1.0","schema_url":"https://blockchains.github.io/blockchainlab-api/v1/schemas/bips.schema.json","description":"Bitcoin Improvement Proposals index parsed from bitcoin/bips.","generated_at":"2026-10-26T08:59:32.278Z","source":"github.com/bitcoin/bips","source_url":"https://github.com/bitcoin/bips","built_by":"Blockchain Lab — https://blockchainlab.com","licence_note":"Data belongs to the named source; check its terms before reuse. Attribute the source and Blockchain Lab.","count":214,"data":[{"number":1,"title":"BIP Purpose and Guidelines","status":"Closed","type":"Process","layer":null,"url":"https://github.com/bitcoin/bips/blob/master/bip-0001.mediawiki"},{"number":2,"title":"BIP process, revised","status":"Closed","type":"Process","layer":null,"url":"https://github.com/bitcoin/bips/blob/master/bip-0002.mediawiki"},{"number":3,"title":"Updated BIP Process","status":"Deployed","type":"Process","layer":null,"url":"https://github.com/bitcoin/bips/blob/master/bip-0003.md"},{"number":8,"title":"Version bits with lock-in by height","status":"Complete","type":"Informational","layer":null,"url":"https://github.com/bitcoin/bips/blob/master/bip-0008.mediawiki"},{"number":9,"title":"Version bits with timeout and delay","status":"Deployed","type":"Informational","layer":null,"url":"https://github.com/bitcoin/bips/blob/master/bip-0009.mediawiki"},{"number":10,"title":"Multi-Sig Transaction Distribution","status":"Closed","type":"Informational","layer":"Applications","url":"https://github.com/bitcoin/bips/blob/master/bip-0010.mediawiki"},{"number":11,"title":"M-of-N Standard Transactions","status":"Deployed","type":"Specification","layer":"Applications","url":"https://github.com/bitcoin/bips/blob/master/bip-0011.mediawiki"},{"number":12,"title":"OP_EVAL","status":"Closed","type":"Specification","layer":"Consensus (soft fork)","url":"https://github.com/bitcoin/bips/blob/master/bip-0012.mediawiki"},{"number":13,"title":"Address Format for pay-to-script-hash","status":"Deployed","type":"Specification","layer":"Applications","url":"https://github.com/bitcoin/bips/blob/master/bip-0013.mediawiki"},{"number":14,"title":"Protocol Version and User Agent","status":"Deployed","type":"Specification","layer":"Peer Services","url":"https://github.com/bitcoin/bips/blob/master/bip-0014.mediawiki"},{"number":15,"title":"Aliases","status":"Closed","type":"Specification","layer":"Applications","url":"https://github.com/bitcoin/bips/blob/master/bip-0015.mediawiki"},{"number":16,"title":"Pay to Script Hash","status":"Deployed","type":"Specification","layer":"Consensus (soft fork)","url":"https://github.com/bitcoin/bips/blob/master/bip-0016.mediawiki"},{"number":17,"title":"OP_CHECKHASHVERIFY (CHV)","status":"Closed","type":"Specification","layer":"Consensus (soft fork)","url":"https://github.com/bitcoin/bips/blob/master/bip-0017.mediawiki"},{"number":18,"title":"hashScriptCheck","status":"Complete","type":"Specification","layer":"Consensus (soft fork)","url":"https://github.com/bitcoin/bips/blob/master/bip-0018.mediawiki"},{"number":19,"title":"M-of-N Standard Transactions (Low SigOp)","status":"Closed","type":"Specification","layer":"Applications","url":"https://github.com/bitcoin/bips/blob/master/bip-0019.mediawiki"},{"number":20,"title":"URI Scheme","status":"Closed","type":"Specification","layer":"Applications","url":"https://github.com/bitcoin/bips/blob/master/bip-0020.mediawiki"},{"number":21,"title":"URI Scheme","status":"Closed","type":"Specification","layer":"Applications","url":"https://github.com/bitcoin/bips/blob/master/bip-0021.mediawiki"},{"number":22,"title":"getblocktemplate - Fundamentals","status":"Deployed","type":"Specification","layer":"API/RPC","url":"https://github.com/bitcoin/bips/blob/master/bip-0022.mediawiki"},{"number":23,"title":"getblocktemplate - Pooled Mining","status":"Deployed","type":"Specification","layer":"API/RPC","url":"https://github.com/bitcoin/bips/blob/master/bip-0023.mediawiki"},{"number":30,"title":"Duplicate transactions","status":"Deployed","type":"Specification","layer":"Consensus (soft fork)","url":"https://github.com/bitcoin/bips/blob/master/bip-0030.mediawiki"},{"number":31,"title":"Pong message","status":"Deployed","type":"Specification","layer":"Peer Services","url":"https://github.com/bitcoin/bips/blob/master/bip-0031.mediawiki"},{"number":32,"title":"Hierarchical Deterministic Wallets","status":"Deployed","type":"Informational","layer":"Applications","url":"https://github.com/bitcoin/bips/blob/master/bip-0032.mediawiki"},{"number":33,"title":"Stratized Nodes","status":"Closed","type":"Specification","layer":"Peer Services","url":"https://github.com/bitcoin/bips/blob/master/bip-0033.mediawiki"},{"number":34,"title":"Block v2, Height in Coinbase","status":"Deployed","type":"Specification","layer":"Consensus (soft fork)","url":"https://github.com/bitcoin/bips/blob/master/bip-0034.mediawiki"},{"number":35,"title":"mempool message","status":"Deployed","type":"Specification","layer":"Peer Services","url":"https://github.com/bitcoin/bips/blob/master/bip-0035.mediawiki"},{"number":36,"title":"Custom Services","status":"Closed","type":"Specification","layer":"Peer Services","url":"https://github.com/bitcoin/bips/blob/master/bip-0036.mediawiki"},{"number":37,"title":"Connection Bloom filtering","status":"Deployed","type":"Specification","layer":"Peer Services","url":"https://github.com/bitcoin/bips/blob/master/bip-0037.mediawiki"},{"number":38,"title":"Passphrase-protected private key","status":"Deployed","type":"Specification","layer":"Applications","url":"https://github.com/bitcoin/bips/blob/master/bip-0038.mediawiki"},{"number":39,"title":"Mnemonic code for generating deterministic keys","status":"Deployed","type":"Specification","layer":"Applications","url":"https://github.com/bitcoin/bips/blob/master/bip-0039.mediawiki"},{"number":42,"title":"A finite monetary supply for Bitcoin","status":"Deployed","type":"Specification","layer":"Consensus (soft fork)","url":"https://github.com/bitcoin/bips/blob/master/bip-0042.mediawiki"},{"number":43,"title":"Purpose Field for Deterministic Wallets","status":"Deployed","type":"Specification","layer":"Applications","url":"https://github.com/bitcoin/bips/blob/master/bip-0043.mediawiki"},{"number":44,"title":"Multi-Account Hierarchy for Deterministic Wallets","status":"Deployed","type":"Specification","layer":"Applications","url":"https://github.com/bitcoin/bips/blob/master/bip-0044.mediawiki"},{"number":45,"title":"Structure for Deterministic P2SH Multisignature Wallets","status":"Complete","type":"Specification","layer":"Applications","url":"https://github.com/bitcoin/bips/blob/master/bip-0045.mediawiki"},{"number":46,"title":"Address Scheme for Timelocked Fidelity Bonds","status":"Draft","type":"Specification","layer":"Applications","url":"https://github.com/bitcoin/bips/blob/master/bip-0046.mediawiki"},{"number":47,"title":"Reusable Payment Codes for Hierarchical Deterministic Wallets","status":"Deployed","type":"Specification","layer":"Applications","url":"https://github.com/bitcoin/bips/blob/master/bip-0047.mediawiki"},{"number":48,"title":"Multi-Script Hierarchy for Multi-Sig Wallets","status":"Deployed","type":"Specification","layer":"Applications","url":"https://github.com/bitcoin/bips/blob/master/bip-0048.mediawiki"},{"number":49,"title":"Derivation scheme for P2WPKH-nested-in-P2SH based accounts","status":"Deployed","type":"Specification","layer":"Applications","url":"https://github.com/bitcoin/bips/blob/master/bip-0049.mediawiki"},{"number":50,"title":"March 2013 Chain Fork Post-Mortem","status":"Deployed","type":"Informational","layer":null,"url":"https://github.com/bitcoin/bips/blob/master/bip-0050.mediawiki"},{"number":52,"title":"Durable, Low Energy Bitcoin PoW","status":"Closed","type":"Specification","layer":"Consensus (hard fork)","url":"https://github.com/bitcoin/bips/blob/master/bip-0052.mediawiki"},{"number":53,"title":"Disallow 64-byte transactions","status":"Draft","type":"Specification","layer":"Consensus (soft fork)","url":"https://github.com/bitcoin/bips/blob/master/bip-0053.mediawiki"},{"number":54,"title":"Consensus Cleanup","status":"Complete","type":"Specification","layer":"Consensus (soft fork)","url":"https://github.com/bitcoin/bips/blob/master/bip-0054.md"},{"number":60,"title":"Fixed Length \"version\" Message (Relay-Transactions Field)","status":"Closed","type":"Specification","layer":"Peer Services","url":"https://github.com/bitcoin/bips/blob/master/bip-0060.mediawiki"},{"number":61,"title":"Reject P2P message","status":"Deployed","type":"Specification","layer":"Peer Services","url":"https://github.com/bitcoin/bips/blob/master/bip-0061.mediawiki"},{"number":62,"title":"Dealing with malleability","status":"Closed","type":"Specification","layer":"Consensus (soft fork)","url":"https://github.com/bitcoin/bips/blob/master/bip-0062.mediawiki"},{"number":64,"title":"getutxo message","status":"Closed","type":"Specification","layer":"Peer Services","url":"https://github.com/bitcoin/bips/blob/master/bip-0064.mediawiki"},{"number":65,"title":"OP_CHECKLOCKTIMEVERIFY","status":"Deployed","type":"Specification","layer":"Consensus (soft fork)","url":"https://github.com/bitcoin/bips/blob/master/bip-0065.mediawiki"},{"number":66,"title":"Strict DER signatures","status":"Deployed","type":"Specification","layer":"Consensus (soft fork)","url":"https://github.com/bitcoin/bips/blob/master/bip-0066.mediawiki"},{"number":67,"title":"Deterministic Pay-to-script-hash multi-signature addresses through public key sorting","status":"Complete","type":"Specification","layer":"Applications","url":"https://github.com/bitcoin/bips/blob/master/bip-0067.mediawiki"},{"number":68,"title":"Relative lock-time using consensus-enforced sequence numbers","status":"Deployed","type":"Specification","layer":"Consensus (soft fork)","url":"https://github.com/bitcoin/bips/blob/master/bip-0068.mediawiki"},{"number":6